Title,Rating,Price,Availability
A Light in the Attic,Three,£51.77,In stock
Tipping the Velvet,One,£53.74,In stock
Soumission,One,£50.10,In stock
Sharp Objects,Four,£47.82,In stock
Sapiens: A Brief History of Humankind,Five,£54.23,In stock
The Requiem Red,One,£22.65,In stock
The Dirty Little Secrets of Getting Your Dream Job,Four,£33.34,In stock
"The Coming Woman: A Novel Based on the Life of the Infamous Feminist, Victoria Woodhull",Three,£17.93,In stock
The Boys in the Boat: Nine Americans and Their Epic Quest for Gold at the 1936 Berlin Olympics,Four,£22.60,In stock
The Black Maria,One,£52.15,In stock
"Starving Hearts (Triangular Trade Trilogy, #1)",Two,£13.99,In stock
Shakespeare's Sonnets,Four,£20.66,In stock
Set Me Free,Five,£17.46,In stock
Scott Pilgrim's Precious Little Life (Scott Pilgrim #1),Five,£52.29,In stock
Rip it Up and Start Again,Five,£35.02,In stock
"Our Band Could Be Your Life: Scenes from the American Indie Underground, 1981-1991",Three,£57.25,In stock
Olio,One,£23.88,In stock
Mesaerion: The Best Science Fiction Stories 1800-1849,One,£37.59,In stock
Libertarianism for Beginners,Two,£51.33,In stock
It's Only the Himalayas,Two,£45.17,In stock
In Her Wake,One,£12.84,In stock
How Music Works,Two,£37.32,In stock
"Foolproof Preserving: A Guide to Small Batch Jams, Jellies, Pickles, Condiments, and More: A Foolproof Guide to Making Small Batch Jams, Jellies, Pickles, Condiments, and More",Three,£30.52,In stock
Chase Me (Paris Nights #2),Five,£25.27,In stock
Black Dust,Five,£34.53,In stock
Birdsong: A Story in Pictures,Three,£54.64,In stock
America's Cradle of Quarterbacks: Western Pennsylvania's Football Factory from Johnny Unitas to Joe Montana,Three,£22.50,In stock
Aladdin and His Wonderful Lamp,Three,£53.13,In stock
Worlds Elsewhere: Journeys Around Shakespeare’s Globe,Five,£40.30,In stock
Wall and Piece,Four,£44.18,In stock
The Four Agreements: A Practical Guide to Personal Freedom,Five,£17.66,In stock
The Five Love Languages: How to Express Heartfelt Commitment to Your Mate,Three,£31.05,In stock
The Elephant Tree,Five,£23.82,In stock
The Bear and the Piano,One,£36.89,In stock
Sophie's World,Five,£15.94,In stock
Penny Maybe,Three,£33.29,In stock
Maude (1883-1993):She Grew Up with the country,Two,£18.02,In stock
"In a Dark, Dark Wood",One,£19.63,In stock
Behind Closed Doors,Four,£52.22,In stock
You can't bury them all: Poems,Two,£33.63,In stock
Slow States of Collapse: Poems,Three,£57.31,In stock
Reasons to Stay Alive,Two,£26.41,In stock
Private Paris (Private #10),Five,£47.61,In stock
#HigherSelfie: Wake Up Your Life. Free Your Soul. Find Your Tribe.,Five,£23.11,In stock
Without Borders (Wanderlove #1),Two,£45.07,In stock
When We Collided,One,£31.77,In stock
"We Love You, Charlie Freeman",Five,£50.27,In stock
Untitled Collection: Sabbath Poems 2014,Four,£14.27,In stock
"Unseen City: The Majesty of Pigeons, the Discreet Charm of Snails & Other Wonders of the Urban Wilderness",Four,£44.18,In stock
Unicorn Tracks,Three,£18.78,In stock
"Unbound: How Eight Technologies Made Us Human, Transformed Society, and Brought Our World to the Brink",One,£25.52,In stock
Tsubasa: WoRLD CHRoNiCLE 2 (Tsubasa WoRLD CHRoNiCLE #2),One,£16.28,In stock
Throwing Rocks at the Google Bus: How Growth Became the Enemy of Prosperity,Three,£31.12,In stock
This One Summer,Four,£19.49,In stock
Thirst,Five,£17.27,In stock
The Torch Is Passed: A Harding Family Story,One,£19.09,In stock
The Secret of Dreadwillow Carse,One,£56.13,In stock
"The Pioneer Woman Cooks: Dinnertime: Comfort Classics, Freezer Food, 16-Minute Meals, and Other Delicious Ways to Solve Supper!",One,£56.41,In stock
The Past Never Ends,Four,£56.50,In stock
The Natural History of Us (The Fine Art of Pretending #2),Three,£45.22,In stock
The Nameless City (The Nameless City #1),Four,£38.16,In stock
The Murder That Never Was (Forensic Instincts #5),Three,£54.11,In stock
The Most Perfect Thing: Inside (and Outside) a Bird's Egg,Four,£42.96,In stock
"The Mindfulness and Acceptance Workbook for Anxiety: A Guide to Breaking Free from Anxiety, Phobias, and Worry Using Acceptance and Commitment Therapy",Four,£23.89,In stock
The Life-Changing Magic of Tidying Up: The Japanese Art of Decluttering and Organizing,Three,£16.77,In stock
"The Inefficiency Assassin: Time Management Tactics for Working Smarter, Not Longer",Five,£20.59,In stock
The Gutsy Girl: Escapades for Your Life of Epic Adventure,One,£37.13,In stock
The Electric Pencil: Drawings from Inside State Hospital No. 3,One,£56.06,In stock
The Death of Humanity: and the Case for Life,Four,£58.11,In stock
"The Bulletproof Diet: Lose up to a Pound a Day, Reclaim Energy and Focus, Upgrade Your Life",Three,£49.05,In stock
The Art Forger,Three,£40.76,In stock
The Age of Genius: The Seventeenth Century and the Birth of the Modern Mind,One,£19.73,In stock
The Activist's Tao Te Ching: Ancient Advice for a Modern Revolution,Five,£32.24,In stock
Spark Joy: An Illustrated Master Class on the Art of Organizing and Tidying Up,Four,£41.83,In stock
Soul Reader,Two,£39.58,In stock
Security,Two,£39.25,In stock
"Saga, Volume 6 (Saga (Collected Editions) #6)",Three,£25.02,In stock
"Saga, Volume 5 (Saga (Collected Editions) #5)",Two,£51.04,In stock
Reskilling America: Learning to Labor in the Twenty-First Century,Two,£19.83,In stock
"Rat Queens, Vol. 3: Demons (Rat Queens (Collected Editions) #11-15)",Three,£50.40,In stock
"Princess Jellyfish 2-in-1 Omnibus, Vol. 01 (Princess Jellyfish 2-in-1 Omnibus #1)",Five,£13.61,In stock
Princess Between Worlds (Wide-Awake Princess #5),Five,£13.34,In stock
"Pop Gun War, Volume 1: Gift",One,£18.97,In stock
"Political Suicide: Missteps, Peccadilloes, Bad Calls, Backroom Hijinx, Sordid Pasts, Rotten Breaks, and Just Plain Dumb Mistakes in the Annals of American Politics",Two,£36.28,In stock
Patience,Three,£10.16,In stock
"Outcast, Vol. 1: A Darkness Surrounds Him (Outcast #1)",Four,£15.44,In stock
orange: The Complete Collection 1 (orange: The Complete Collection #1),One,£48.41,In stock
Online Marketing for Busy Authors: A Step-By-Step Guide,One,£46.35,In stock
On a Midnight Clear,Three,£14.07,In stock
Obsidian (Lux #1),Two,£14.86,In stock
My Paris Kitchen: Recipes and Stories,Two,£33.37,In stock
Masks and Shadows,Two,£56.40,In stock
"Mama Tried: Traditional Italian Cooking for the Screwed, Crude, Vegan, and Tattooed",Four,£14.02,In stock
"Lumberjanes, Vol. 2: Friendship to the Max (Lumberjanes #5-8)",Two,£46.91,In stock
"Lumberjanes, Vol. 1: Beware the Kitten Holy (Lumberjanes #1-4)",Three,£45.61,In stock
Lumberjanes Vol. 3: A Terrible Plan (Lumberjanes #9-12),Two,£19.92,In stock
"Layered: Baking, Building, and Styling Spectacular Cakes",One,£40.11,In stock
Judo: Seven Steps to Black Belt (an Introductory Guide for Beginners),Two,£53.90,In stock
Join,Five,£35.67,In stock
In the Country We Love: My Family Divided,Four,£22.00,In stock
Immunity: How Elie Metchnikoff Changed the Course of Modern Medicine,Five,£57.36,In stock
"I Hate Fairyland, Vol. 1: Madly Ever After (I Hate Fairyland (Compilations) #1-5)",Two,£29.17,In stock
I am a Hero Omnibus Volume 1,Three,£54.63,In stock
How to Be Miserable: 40 Strategies You Already Use,One,£46.03,In stock
Her Backup Boyfriend (The Sorensen Family #1),One,£33.97,In stock
"Giant Days, Vol. 2 (Giant Days #5-8)",Two,£22.11,In stock
Forever and Forever: The Courtship of Henry Longfellow and Fanny Appleton,Three,£29.69,In stock
First and First (Five Boroughs #3),Four,£15.97,In stock
Fifty Shades Darker (Fifty Shades #2),One,£21.96,In stock
Everydata: The Misinformation Hidden in the Little Data You Consume Every Day,Two,£54.35,In stock
"Don't Be a Jerk: And Other Practical Advice from Dogen, Japan's Greatest Zen Master",Two,£37.97,In stock
Danganronpa Volume 1,Four,£51.99,In stock
Crown of Midnight (Throne of Glass #2),Three,£43.29,In stock
"Codename Baboushka, Volume 1: The Conclave of Death",Four,£36.72,In stock
Camp Midnight,Four,£17.08,In stock
Call the Nurse: True Stories of a Country Nurse on a Scottish Isle,Five,£29.14,In stock
Burning,Three,£28.81,In stock
Bossypants,Two,£49.46,In stock
"Bitch Planet, Vol. 1: Extraordinary Machine (Bitch Planet (Collected Editions))",Two,£37.92,In stock
"Avatar: The Last Airbender: Smoke and Shadow, Part 3 (Smoke and Shadow #3)",Two,£28.09,In stock
Algorithms to Live By: The Computer Science of Human Decisions,One,£30.81,In stock
A World of Flavor: Your Gluten Free Passport,One,£42.95,In stock
"A Piece of Sky, a Grain of Rice: A Memoir in Four Meditations",Five,£56.76,In stock
A Murder in Time,One,£16.64,In stock
A Flight of Arrows (The Pathfinders #2),Five,£55.53,In stock
A Fierce and Subtle Poison,Four,£28.13,In stock
A Court of Thorns and Roses (A Court of Thorns and Roses #1),One,£52.37,In stock
(Un)Qualified: How God Uses Broken People to Do Big Things,Five,£54.00,In stock
You Are What You Love: The Spiritual Power of Habit,Four,£21.87,In stock
"William Shakespeare's Star Wars: Verily, A New Hope (William Shakespeare's Star Wars #4)",Four,£43.30,In stock
Tuesday Nights in 1980,Two,£21.04,In stock
Tracing Numbers on a Train,Three,£41.60,In stock
Throne of Glass (Throne of Glass #1),Three,£35.07,In stock
Thomas Jefferson and the Tripoli Pirates: The Forgotten War That Changed American History,One,£59.64,In stock
Thirteen Reasons Why,One,£52.72,In stock
The White Cat and the Monk: A Retelling of the Poem “Pangur Bán”,Four,£58.08,In stock
The Wedding Dress,One,£24.12,In stock
The Vacationers,Four,£42.15,In stock
The Third Wave: An Entrepreneur’s Vision of the Future,Five,£12.61,In stock
The Stranger,Four,£17.44,In stock
The Shadow Hero (The Shadow Hero),One,£33.14,In stock
The Secret (The Secret #1),Four,£27.37,In stock
The Regional Office Is Under Attack!,Five,£51.36,In stock
The Psychopath Test: A Journey Through the Madness Industry,Two,£36.00,In stock
The Project,One,£10.65,In stock
The Power of Now: A Guide to Spiritual Enlightenment,Two,£43.54,In stock
The Omnivore's Dilemma: A Natural History of Four Meals,Two,£38.21,In stock
The Nerdy Nummies Cookbook: Sweet Treats for the Geek in All of Us,Five,£37.34,In stock
The Murder of Roger Ackroyd (Hercule Poirot #4),Four,£44.10,In stock
The Mistake (Off-Campus #2),Three,£43.29,In stock
The Matchmaker's Playbook (Wingmen Inc. #1),One,£55.85,In stock
The Love and Lemons Cookbook: An Apple-to-Zucchini Celebration of Impromptu Cooking,Two,£37.60,In stock
The Long Shadow of Small Ghosts: Murder and Memory in an American City,One,£10.97,In stock
The Kite Runner,Four,£41.82,In stock
The House by the Lake,One,£36.95,In stock
The Glittering Court (The Glittering Court #1),One,£44.28,In stock
The Girl on the Train,Two,£55.02,In stock
The Genius of Birds,One,£17.24,In stock
The Emerald Mystery,Two,£23.15,In stock
The Cookies & Cups Cookbook: 125+ sweet & savory recipes reminding you to Always Eat Dessert First,One,£41.25,In stock
The Bridge to Consciousness: I'm Writing the Bridge Between Science and Our Old and New Beliefs.,Three,£32.00,In stock
The Artist's Way: A Spiritual Path to Higher Creativity,Five,£38.49,In stock
The Art of War,Five,£33.34,In stock
The Argonauts,Two,£10.93,In stock
The 10% Entrepreneur: Live Your Startup Dream Without Quitting Your Day Job,Three,£27.55,In stock
Suddenly in Love (Lake Haven #1),Two,£55.99,In stock
Something More Than This,Four,£16.24,In stock
Soft Apocalypse,Two,£26.12,In stock
So You've Been Publicly Shamed,Two,£12.23,In stock
Shoe Dog: A Memoir by the Creator of NIKE,Two,£23.99,In stock
"Shobu Samurai, Project Aryoku (#3)",Three,£29.06,In stock
Secrets and Lace (Fatal Hearts #1),One,£20.27,In stock
Scarlett Epstein Hates It Here,Five,£43.55,In stock
Romero and Juliet: A Tragic Tale of Love and Zombies,One,£36.94,In stock
Redeeming Love,Five,£20.47,In stock
Poses for Artists Volume 1 - Dynamic and Sitting Poses: An Essential Reference for Figure Drawing and the Human Form,One,£41.06,In stock
Poems That Make Grown Women Cry,Four,£14.19,In stock
"Nightingale, Sing",One,£38.28,In stock
Night Sky with Exit Wounds,One,£41.05,In stock
Mrs. Houdini,Five,£30.25,In stock
Modern Romance,Five,£28.26,In stock
Miss Peregrine’s Home for Peculiar Children (Miss Peregrine’s Peculiar Children #1),One,£10.76,In stock
Louisa: The Extraordinary Life of Mrs. Adams,Two,£16.85,In stock
Little Red,Three,£13.47,In stock
Library of Souls (Miss Peregrine’s Peculiar Children #3),Five,£48.56,In stock
Large Print Heart of the Pride,Two,£19.15,In stock
I Had a Nice Time And Other Lies...: How to find love & sh*t like that,Four,£57.36,In stock
Hollow City (Miss Peregrine’s Peculiar Children #2),One,£42.98,In stock
Grumbles,Two,£22.16,In stock
Full Moon over Noah’s Ark: An Odyssey to Mount Ararat and Beyond,Four,£49.43,In stock
Frostbite (Vampire Academy #2),Five,£29.99,In stock
Follow You Home,One,£21.36,In stock
First Steps for New Christians (Print Edition),One,£29.00,In stock
Finders Keepers (Bill Hodges Trilogy #2),Five,£53.53,In stock
"Fables, Vol. 1: Legends in Exile (Fables #1)",Four,£41.62,In stock
Eureka Trivia 6.0,Four,£54.59,In stock
Drive: The Surprising Truth About What Motivates Us,Four,£34.95,In stock
Done Rubbed Out (Reightman & Bailey #1),Five,£37.72,In stock
Doing It Over (Most Likely To #1),Three,£35.61,In stock
"Deliciously Ella Every Day: Quick and Easy Recipes for Gluten-Free Snacks, Packed Lunches, and Simple Meals",Three,£42.16,In stock
Dark Notes,Five,£19.19,In stock
"Daring Greatly: How the Courage to Be Vulnerable Transforms the Way We Live, Love, Parent, and Lead",Three,£19.43,In stock
Close to You,Four,£49.46,In stock
Chasing Heaven: What Dying Taught Me About Living,Two,£37.80,In stock
Big Magic: Creative Living Beyond Fear,Three,£30.80,In stock
Becoming Wise: An Inquiry into the Mystery and Art of Living,Two,£27.43,In stock
Beauty Restored (Riley Family Legacy Novellas #3),Two,£11.11,In stock
Batman: The Long Halloween (Batman),Two,£36.50,In stock
Batman: The Dark Knight Returns (Batman),Five,£15.38,In stock
Ayumi's Violin,Two,£15.48,In stock
Anonymous,Four,£46.82,In stock
Amy Meets the Saints and Sages,Three,£18.46,In stock
Amid the Chaos,One,£36.58,In stock
Amatus,Five,£50.54,In stock
Agnostic: A Spirited Manifesto,Five,£12.51,In stock
Zealot: The Life and Times of Jesus of Nazareth,Three,£24.70,In stock
You (You #1),Five,£43.61,In stock
"Wonder Woman: Earth One, Volume One (Wonder Woman: Earth One #1)",Four,£37.34,In stock
Wild Swans,Two,£14.36,In stock
Why the Right Went Wrong: Conservatism--From Goldwater to the Tea Party and Beyond,Four,£52.65,In stock
Whole Lotta Creativity Going On: 60 Fun and Unusual Exercises to Awaken and Strengthen Your Creativity,Four,£38.20,In stock
What's It Like in Space?: Stories from Astronauts Who've Been There,Two,£19.60,In stock
"We Are Robin, Vol. 1: The Vigilante Business (We Are Robin #1)",One,£53.90,In stock
Walt Disney's Alice in Wonderland,Five,£12.96,In stock
V for Vendetta (V for Vendetta Complete),Four,£37.10,In stock
Until Friday Night (The Field Party #1),Two,£46.31,In stock
"Unbroken: A World War II Story of Survival, Resilience, and Redemption",Two,£45.95,In stock
Twenty Yawns,Two,£22.08,In stock
Through the Woods,Two,£25.38,In stock
This Is Where It Ends,Two,£27.12,In stock
The Year of Magical Thinking,Two,£43.04,In stock
The Wright Brothers,Four,£56.80,In stock
The White Queen (The Cousins' War #1),Five,£25.91,In stock
The Wedding Pact (The O'Malleys #2),Three,£32.61,In stock
The Time Keeper,Five,£27.88,In stock
The Testament of Mary,Four,£52.67,In stock
The Star-Touched Queen,Five,£46.02,In stock
The Songs of the Gods,Five,£44.48,In stock
The Song of Achilles,Five,£37.40,In stock
The Rosie Project (Don Tillman #1),One,£54.04,In stock
The Power of Habit: Why We Do What We Do in Life and Business,Three,£16.88,In stock
The Marriage of Opposites,Four,£28.08,In stock
The Lucifer Effect: Understanding How Good People Turn Evil,One,£10.40,In stock
The Long Haul (Diary of a Wimpy Kid #9),One,£44.07,In stock
The Loney,One,£23.40,In stock
The Literature Book (Big Ideas Simply Explained),Three,£17.43,In stock
The Last Mile (Amos Decker #2),Two,£54.21,In stock
The Immortal Life of Henrietta Lacks,Two,£40.67,In stock
The Hidden Oracle (The Trials of Apollo #1),Two,£52.26,In stock
The Help Yourself Cookbook for Kids: 60 Easy Plant-Based Recipes Kids Can Make to Stay Healthy and Save the Earth,Three,£28.77,In stock
The Guilty (Will Robie #4),Two,£13.82,In stock
The First Hostage (J.B. Collins #2),Three,£25.85,In stock
The Dovekeepers,One,£48.78,In stock
The Darkest Lie,Five,£35.35,In stock
The Bane Chronicles (The Bane Chronicles #1-11),Four,£44.73,In stock
The Bad-Ass Librarians of Timbuktu: And Their Race to Save the World’s Most Precious Manuscripts,One,£15.77,In stock
The 14th Colony (Cotton Malone #11),One,£39.24,In stock
That Darkness (Gardiner and Renner #1),One,£13.92,In stock
Tastes Like Fear (DI Marnie Rome #3),One,£10.69,In stock
Take Me with You,Three,£45.21,In stock
Swell: A Year of Waves,One,£45.58,In stock
Superman Vol. 1: Before Truth (Superman by Gene Luen Yang #1),Five,£11.89,In stock
Still Life with Bread Crumbs,Three,£26.41,In stock
Steve Jobs,Five,£39.50,In stock
Sorting the Beef from the Bull: The Science of Food Fraud Forensics,Four,£44.74,In stock
Someone Like You (The Harrisons #2),Five,£52.79,In stock
"So Cute It Hurts!!, Vol. 6 (So Cute It Hurts!! #6)",Four,£35.43,In stock
Shtum,Four,£55.84,In stock
See America: A Celebration of Our National Parks & Treasured Sites,Three,£48.87,In stock
salt.,Four,£46.78,In stock
Robin War,Three,£47.82,In stock
"Red Hood/Arsenal, Vol. 1: Open for Business (Red Hood/Arsenal #1)",Two,£25.48,In stock
Rain Fish,Three,£23.57,In stock
"Quarter Life Poetry: Poems for the Young, Broke and Hangry",Five,£50.89,In stock
Pet Sematary,Three,£10.56,In stock
"Overload: How to Unplug, Unwind, and Unleash Yourself from the Pressure of Stress",Three,£52.15,In stock
Once Was a Time,Two,£18.28,In stock
Old School (Diary of a Wimpy Kid #10),Five,£11.83,In stock
No Dream Is Too High: Life Lessons From a Man Who Walked on the Moon,Two,£21.95,In stock
"Naruto (3-in-1 Edition), Vol. 14: Includes Vols. 40, 41 & 42 (Naruto: Omnibus #14)",Two,£38.39,In stock
My Name Is Lucy Barton,One,£41.56,In stock
My Mrs. Brown,Three,£24.48,In stock
My Kind of Crazy,One,£40.36,In stock
Mr. Mercedes (Bill Hodges Trilogy #1),One,£28.90,In stock
More Than Music (Chasing the Dream #1),Two,£37.61,In stock
Made to Stick: Why Some Ideas Survive and Others Die,Five,£38.85,In stock
Luis Paints the World,Three,£53.95,In stock
Luckiest Girl Alive,Three,£49.83,In stock
Lowriders to the Center of the Earth (Lowriders in Space #2),Two,£51.51,In stock
Love Is a Mix Tape (Music #1),One,£18.03,In stock
Looking for Lovely: Collecting the Moments that Matter,Five,£29.14,In stock
"Living Leadership by Insight: A Good Leader Achieves, a Great Leader Builds Monuments",Four,£46.91,In stock
Let It Out: A Journey Through Journaling,Five,£26.79,In stock
Lady Midnight (The Dark Artifices #1),Five,£16.28,In stock
"It's All Easy: Healthy, Delicious Weeknight Meals in under 30 Minutes",One,£19.55,In stock
Island of Dragons (Unwanteds #7),One,£29.65,In stock
I Know What I'm Doing -- and Other Lies I Tell Myself: Dispatches from a Life Under Construction,Four,£25.98,In stock
I Am Pilgrim (Pilgrim #1),Four,£10.60,In stock
"Hyperbole and a Half: Unfortunate Situations, Flawed Coping Mechanisms, Mayhem, and Other Things That Happened",Five,£14.75,In stock
"Hush, Hush (Hush, Hush #1)",Three,£47.02,In stock
Hold Your Breath (Search and Rescue #1),One,£28.82,In stock
Hamilton: The Revolution,Three,£58.79,In stock
Greek Mythic History,Five,£10.23,In stock
God: The Most Unpleasant Character in All Fiction,Five,£30.03,In stock
Glory over Everything: Beyond The Kitchen House,Three,£45.84,In stock
Feathers: Displays of Brilliant Plumage,Three,£49.05,In stock
"Far & Away: Places on the Brink of Change: Seven Continents, Twenty-Five Years",Four,£15.06,In stock
Every Last Word,Three,£46.47,In stock
Eligible (The Austen Project #4),Three,£27.09,In stock
El Deafo,Five,£57.62,In stock
Eight Hundred Grapes,Four,£14.39,In stock
"Eaternity: More than 150 Deliciously Easy Vegan Recipes for a Long, Healthy, Satisfied, Joyful Life",Five,£51.75,In stock
"Eat Fat, Get Thin",Two,£54.07,In stock
Don't Get Caught,One,£55.35,In stock
Doctor Sleep (The Shining #2),Two,£40.12,In stock
Demigods & Magicians: Percy and Annabeth Meet the Kanes (Percy Jackson & Kane Chronicles Crossover #1-3),Five,£37.51,In stock
Dear Mr. Knightley,Five,£11.21,In stock
Daily Fantasy Sports,One,£36.58,In stock
Crazy Love: Overwhelmed by a Relentless God,Two,£47.72,In stock
Cometh the Hour (The Clifton Chronicles #6),Three,£25.01,In stock
Code Name Verity (Code Name Verity #1),Four,£22.13,In stock
Clockwork Angel (The Infernal Devices #1),One,£44.14,In stock
City of Glass (The Mortal Instruments #3),Four,£56.02,In stock
City of Fallen Angels (The Mortal Instruments #4),Four,£11.23,In stock
City of Bones (The Mortal Instruments #1),One,£43.28,In stock
City of Ashes (The Mortal Instruments #2),One,£47.27,In stock
Cell,Four,£20.29,In stock
Catching Jordan (Hundred Oaks),Three,£50.83,In stock
"Carry On, Warrior: Thoughts on Life Unarmed",Three,£31.85,In stock
Carrie,Two,£46.23,In stock
Buying In: The Secret Dialogue Between What We Buy and Who We Are,Four,£37.80,In stock
Brain on Fire: My Month of Madness,Five,£49.32,In stock
Batman: Europa,Two,£32.01,In stock
Barefoot Contessa Back to Basics,One,£28.01,In stock
Barefoot Contessa at Home: Everyday Recipes You'll Make Over and Over Again,Five,£50.62,In stock
Balloon Animals,Three,£17.03,In stock
Art Ops Vol. 1,Three,£48.80,In stock
Aristotle and Dante Discover the Secrets of the Universe (Aristotle and Dante Discover the Secrets of the Universe #1),Four,£58.14,In stock
Angels Walking (Angels Walking #1),Two,£34.20,In stock
Angels & Demons (Robert Langdon #1),Three,£51.48,In stock
All the Light We Cannot See,Five,£29.87,In stock
"Adulthood Is a Myth: A ""Sarah's Scribbles"" Collection",Two,£10.90,In stock
Abstract City,Five,£56.37,In stock
A Time of Torment (Charlie Parker #14),Five,£48.35,In stock
A Study in Scarlet (Sherlock Holmes #1),Two,£16.73,In stock
"A Series of Catastrophes and Miracles: A True Story of Love, Science, and Cancer",Two,£56.48,In stock
A People's History of the United States,Two,£40.79,In stock
A Man Called Ove,One,£39.72,In stock
A Distant Mirror: The Calamitous 14th Century,Three,£14.58,In stock
A Brush of Wings (Angels Walking #3),One,£55.51,In stock
1491: New Revelations of the Americas Before Columbus,Three,£21.80,In stock
"The Three Searches, Meaning, and the Story",Three,£13.33,In stock
Searching for Meaning in Gailana,One,£38.73,In stock
Rook,Four,£37.86,In stock
My Kitchen Year: 136 Recipes That Saved My Life,Two,£11.53,In stock
13 Hours: The Inside Account of What Really Happened In Benghazi,One,£27.06,In stock
Will You Won't You Want Me?,Three,£13.86,In stock
Tipping Point for Planet Earth: How Close Are We to the Edge?,One,£37.55,In stock
The Star-Touched Queen,Five,£32.30,In stock
The Silent Sister (Riley MacPherson #1),Five,£46.29,In stock
The Midnight Watch: A Novel of the Titanic and the Californian,One,£26.20,In stock
The Lonely City: Adventures in the Art of Being Alone,Two,£33.26,In stock
The Gray Rhino: How to Recognize and Act on the Obvious Dangers We Ignore,Four,£59.15,In stock
The Golden Condom: And Other Essays on Love Lost and Found,One,£39.43,In stock
The Epidemic (The Program 0.6),Five,£14.44,In stock
The Dinner Party,Two,£56.54,In stock
The Diary of a Young Girl,Three,£59.90,In stock
The Children,Three,£11.88,In stock
Stars Above (The Lunar Chronicles #4.5),Two,£48.05,In stock
Snatched: How A Drug Queen Went Undercover for the DEA and Was Kidnapped By Colombian Guerillas,Three,£21.21,In stock
Raspberry Pi Electronics Projects for the Evil Genius,Four,£49.67,In stock
Quench Your Own Thirst: Business Lessons Learned Over a Beer or Two,One,£43.14,In stock
Psycho: Sanitarium (Psycho #1.5),Five,£36.97,In stock
Poisonous (Max Revere Novels #3),Three,£26.80,In stock
One with You (Crossfire #5),Four,£15.71,In stock
No Love Allowed (Dodge Cove #1),Four,£54.65,In stock
Murder at the 42nd Street Library (Raymond Ambler #1),Four,£54.36,In stock
Most Wanted,Three,£35.28,In stock
"Love, Lies and Spies",Two,£20.55,In stock
How to Speak Golf: An Illustrated Guide to Links Lingo,Five,£58.32,In stock
Hide Away (Eve Duncan #20),One,£11.84,In stock
Furiously Happy: A Funny Book About Horrible Things,Four,£41.46,In stock
Everyday Italian: 125 Simple and Delicious Recipes,Five,£20.10,In stock
Equal Is Unfair: America's Misguided Fight Against Income Inequality,One,£56.86,In stock
Eleanor & Park,Five,£56.51,In stock
Dirty (Dive Bar #1),Four,£40.83,In stock
Can You Keep a Secret? (Fear Street Relaunch #4),One,£48.64,In stock
Boar Island (Anna Pigeon #19),Three,£59.48,In stock
A Paris Apartment,Four,£39.01,In stock
"A la Mode: 120 Recipes in 60 Pairings: Pies, Tarts, Cakes, Crisps, and More Topped with Ice Cream, Gelato, Frozen Custard, and More",One,£38.77,In stock
Troublemaker: Surviving Hollywood and Scientology,Two,£48.39,In stock
The Widow,Two,£27.26,In stock
