Title,Rating,Price,Availability
"The Sleep Revolution: Transforming Your Life, One Night at a Time",Four,£11.68,In stock
The Improbability of Love,One,£59.45,In stock
The Art of Startup Fundraising,Three,£21.00,In stock
Take Me Home Tonight (Rock Star Romance #3),Three,£53.98,In stock
Sleeping Giants (Themis Files #1),One,£48.74,In stock
"Setting the World on Fire: The Brief, Astonishing Life of St. Catherine of Siena",Two,£21.15,In stock
Playing with Fire,Three,£13.71,In stock
Off the Hook (Fishing for Trouble #1),Three,£47.67,In stock
Mothering Sunday,Two,£13.34,In stock
"Mother, Can You Not?",Five,£16.89,In stock
M Train,One,£27.18,In stock
Lilac Girls,Two,£17.28,In stock
Lies and Other Acts of Love,One,£45.14,In stock
Lab Girl,One,£40.85,In stock
Keep Me Posted,Four,£20.46,In stock
It Didn't Start with You: How Inherited Family Trauma Shapes Who We Are and How to End the Cycle,Three,£56.27,In stock
Grey (Fifty Shades #4),Four,£48.49,In stock
"Exit, Pursued by a Bear",Four,£51.34,In stock
Daredevils,Three,£16.34,In stock
Cravings: Recipes for What You Want to Eat,Three,£20.50,In stock
Born for This: How to Find the Work You Were Meant to Do,Five,£21.59,In stock
Arena,Four,£21.36,In stock
Adultery,Five,£20.88,In stock
A Mother's Reckoning: Living in the Aftermath of Tragedy,Three,£19.53,In stock
A Gentleman's Position (Society of Gentlemen #3),Five,£14.75,In stock
11/22/63,Three,£48.48,In stock
"10% Happier: How I Tamed the Voice in My Head, Reduced Stress Without Losing My Edge, and Found Self-Help That Actually Works",Two,£24.57,In stock
10-Day Green Smoothie Cleanse: Lose Up to 15 Pounds in 10 Days!,Five,£49.71,In stock
Without Shame,Five,£48.27,In stock
Watchmen,Four,£58.05,In stock
Unlimited Intuition Now,Four,£58.87,In stock
Underlying Notes,Two,£11.82,In stock
The Shack,One,£28.03,In stock
The New Brand You: Your New Image Makes the Sale for You,Five,£44.05,In stock
"The Moosewood Cookbook: Recipes from Moosewood Restaurant, Ithaca, New York",Four,£12.34,In stock
The Flowers Lied,Two,£16.68,In stock
"The Fabric of the Cosmos: Space, Time, and the Texture of Reality",One,£55.91,In stock
The Book of Mormon,Three,£24.57,In stock
The Art and Science of Low Carbohydrate Living,Five,£52.98,In stock
The Alien Club,One,£54.40,In stock
Suzie Snowflake: One beautiful flake (a self-esteem story),Five,£54.81,In stock
Nap-a-Roo,One,£25.08,In stock
"NaNo What Now? Finding your editing process, revising your NaNoWriMo book and building a writing career through publishing and beyond",Four,£10.41,In stock
Modern Day Fables,Two,£47.44,In stock
If I Gave You God's Phone Number....: Searching for Spirituality in America,One,£20.91,In stock
"Fruits Basket, Vol. 9 (Fruits Basket #9)",Four,£33.95,In stock
Dress Your Family in Corduroy and Denim,Three,£43.68,In stock
Don't Forget Steven,One,£33.23,In stock
Chernobyl 01:23:40: The Incredible True Story of the World's Worst Nuclear Disaster,Two,£35.92,In stock
Art and Fear: Observations on the Perils (and Rewards) of Artmaking,Four,£48.63,In stock
A Shard of Ice (The Black Symphony Saga #1),Three,£56.63,In stock
A Hero's Curse (The Unseen Chronicles #1),Three,£50.49,In stock
23 Degrees South: A Tropical Tale of Changing Whether...,Two,£35.79,In stock
"Zero to One: Notes on Startups, or How to Build the Future",Three,£34.06,In stock
Why Not Me?,One,£17.76,In stock
When Breath Becomes Air,Two,£39.36,In stock
Vagabonding: An Uncommon Guide to the Art of Long-Term World Travel,Two,£36.94,In stock
The Unlikely Pilgrimage of Harold Fry (Harold Fry #1),Five,£43.62,In stock
The New Drawing on the Right Side of the Brain,Three,£43.02,In stock
"The Midnight Assassin: Panic, Scandal, and the Hunt for America's First Serial Killer",Four,£28.45,In stock
The Martian (The Martian #1),Two,£41.39,In stock
The High Mountains of Portugal,One,£51.15,In stock
The Grownup,One,£35.88,In stock
The E-Myth Revisited: Why Most Small Businesses Don't Work and What to Do About It,One,£36.91,In stock
South of Sunshine,One,£28.93,In stock
Smarter Faster Better: The Secrets of Being Productive in Life and Business,Five,£38.89,In stock
Silence in the Dark (Logan Point #4),Three,£58.33,In stock
Shadows of the Past (Logan Point #1),Five,£39.67,In stock
Roller Girl,Five,£14.10,In stock
Rising Strong,Three,£21.82,In stock
Proofs of God: Classical Arguments from Tertullian to Barth,One,£54.21,In stock
Please Kill Me: The Uncensored Oral History of Punk,Four,£31.19,In stock
Out of Print: City Lights Spotlight No. 14,Five,£53.64,In stock
My Life Next Door (My Life Next Door ),Five,£36.39,In stock
Miller's Valley,Two,£58.54,In stock
Man's Search for Meaning,Three,£29.48,In stock
"Love That Boy: What Two Presidents, Eight Road Trips, and My Son Taught Me About a Parent's Expectations",Two,£25.06,In stock
Living Forward: A Proven Plan to Stop Drifting and Get the Life You Want,Three,£12.55,In stock
Les Fleurs du Mal,Five,£29.04,In stock
Left Behind (Left Behind #1),Two,£40.72,In stock
Kill 'Em and Leave: Searching for James Brown and the American Soul,Five,£45.05,In stock
Kierkegaard: A Christian Missionary to Christians,One,£47.13,In stock
John Vassos: Industrial Design for Modern Life,Four,£20.22,In stock
I'll Give You the Sun,One,£56.48,In stock
I Will Find You,One,£44.21,In stock
Hystopia: A Novel,Four,£21.96,In stock
Howl and Other Poems,Two,£40.45,In stock
History of Beauty,Four,£10.29,In stock
Heaven is for Real: A Little Boy's Astounding Story of His Trip to Heaven and Back,Two,£52.86,In stock
Future Shock (Future Shock #1),Five,£55.65,In stock
Ender's Game (The Ender Quintet #1),One,£43.64,In stock
Diary of a Citizen Scientist: Chasing Tiger Beetles and Other New Ways of Engaging the World,One,£28.41,In stock
Death by Leisure: A Cautionary Tale,Four,£37.51,In stock
Brilliant Beacons: A History of the American Lighthouse,Three,£11.45,In stock
Brazen: The Courage to Find the You That's Been Hiding,Two,£19.22,In stock
Between the World and Me,Four,£56.91,In stock
Being Mortal: Medicine and What Matters in the End,Four,£55.06,In stock
"A Murder Over a Girl: Justice, Gender, Junior High",Three,£13.20,In stock
32 Yolks,Two,£53.63,In stock
"""Most Blessed of the Patriarchs"": Thomas Jefferson and the Empire of the Imagination",Five,£44.48,In stock
You Are a Badass: How to Stop Doubting Your Greatness and Start Living an Awesome Life,Three,£12.08,In stock
Wildlife of New York: A Five-Borough Coloring Book,Two,£22.14,In stock
What Happened on Beale Street (Secrets of the South Mysteries #2),Five,£25.37,In stock
Unreasonable Hope: Finding Faith in the God Who Brings Purpose to Your Pain,Two,£46.33,In stock
Under the Tuscan Sun,Three,£37.33,In stock
Toddlers Are A**holes: It's Not Your Fault,One,£25.55,In stock
The Year of Living Biblically: One Man's Humble Quest to Follow the Bible as Literally as Possible,One,£34.72,In stock
The Whale,Four,£35.96,In stock
The Story of Art,Four,£41.14,In stock
The Origin of Species,Four,£10.01,In stock
The Great Gatsby,Four,£36.05,In stock
The Good Girl,Three,£49.03,In stock
The Glass Castle,One,£16.24,In stock
The Faith of Christopher Hitchens: The Restless Soul of the World's Most Notorious Atheist,One,£39.55,In stock
The Drowning Girls,Three,£35.67,In stock
The Constant Princess (The Tudor Court #1),Three,£16.62,In stock
The Bourne Identity (Jason Bourne #1),Four,£42.78,In stock
The Bachelor Girl's Guide to Murder (Herringford and Watts Mysteries #1),Five,£52.30,In stock
The Art Book,Two,£32.34,In stock
The 7 Habits of Highly Effective People: Powerful Lessons in Personal Change,Four,£33.17,In stock
Team of Rivals: The Political Genius of Abraham Lincoln,Five,£20.12,In stock
Steal Like an Artist: 10 Things Nobody Told You About Being Creative,Two,£20.90,In stock
"Sit, Stay, Love",Three,£20.90,In stock
Sister Dear,Four,£40.20,In stock
"Shrunken Treasures: Literary Classics, Short, Sweet, and Silly",Three,£52.87,In stock
"Rich Dad, Poor Dad",One,£51.74,In stock
Raymie Nightingale,Two,£34.41,In stock
Playing from the Heart,One,£32.38,In stock
Nightstruck: A Novel,Four,£50.35,In stock
"Naturally Lean: 125 Nourishing Gluten-Free, Plant-Based Recipes--All Under 300 Calories",Five,£11.38,In stock
Meternity,Three,£43.58,In stock
Memoirs of a Geisha,Three,£49.67,In stock
Like Never Before (Walker Family #2),Two,£28.77,In stock
Life of Pi,Four,£13.22,In stock
Leave This Song Behind: Teen Poetry at Its Best,Five,£51.17,In stock
King's Folly (The Kinsman Chronicles #1),Five,£39.61,In stock
John Adams,Four,£57.43,In stock
How to Cook Everything Vegetarian: Simple Meatless Recipes for Great Food (How to Cook Everything),Four,£46.01,In stock
How to Be a Domestic Goddess: Baking and the Art of Comfort Cooking,Two,£28.25,In stock
Good in Bed (Cannie Shapiro #1),Five,£37.05,In stock
"Fruits Basket, Vol. 7 (Fruits Basket #7)",One,£19.57,In stock
For the Love: Fighting for Grace in a World of Impossible Standards,Three,£45.13,In stock
Finding God in the Ruins: How God Redeems Pain,Two,£46.64,In stock
Every Heart a Doorway (Every Heart A Doorway #1),Five,£12.16,In stock
Delivering the Truth (Quaker Midwife Mystery #1),Four,£20.89,In stock
Counted With the Stars (Out from Egypt #1),Five,£17.97,In stock
"Chronicles, Vol. 1",Two,£52.60,In stock
Blue Like Jazz: Nonreligious Thoughts on Christian Spirituality,One,£25.77,In stock
Benjamin Franklin: An American Life,Three,£48.19,In stock
"At The Existentialist Café: Freedom, Being, and apricot cocktails with: Jean-Paul Sartre, Simone de Beauvoir, Albert Camus, Martin Heidegger, Edmund Husserl, Karl Jaspers, Maurice Merleau-Ponty and others",Five,£29.93,In stock
A Summer In Europe,Two,£44.34,In stock
A Short History of Nearly Everything,Five,£52.40,In stock
A Gathering of Shadows (Shades of Magic #2),Four,£44.81,In stock
The Sound Of Love,Five,£57.84,In stock
The Rise and Fall of the Third Reich: A History of Nazi Germany,Two,£39.67,In stock
The Perks of Being a Wallflower,Three,£55.02,In stock
The Mysterious Affair at Styles (Hercule Poirot #1),Four,£24.80,In stock
The Man Who Mistook His Wife for a Hat and Other Clinical Tales,Four,£59.45,In stock
The Makings of a Fatherless Child,Two,£31.58,In stock
The Joy of Cooking,Four,£43.27,In stock
The Invention of Wings,One,£37.34,In stock
The Hobbit (Middle-Earth Universe),Five,£17.80,In stock
The Great Railway Bazaar,One,£30.54,In stock
The Golden Compass (His Dark Materials #1),One,£18.77,In stock
The God Delusion,Three,£46.85,In stock
The Girl You Left Behind (The Girl You Left Behind #1),One,£15.79,In stock
The Fellowship of the Ring (The Lord of the Rings #1),Two,£10.27,In stock
The Collected Poems of W.B. Yeats (The Collected Works of W.B. Yeats #1),Five,£15.42,In stock
The Barefoot Contessa Cookbook,Five,£59.92,In stock
Tell the Wolves I'm Home,Two,£50.96,In stock
Ship Leaves Harbor: Essays on Travel by a Recovering Journeyman,Three,£30.60,In stock
Pride and Prejudice,Four,£19.27,In stock
Musicophilia: Tales of Music and the Brain,One,£46.58,In stock
Mere Christianity,Three,£48.51,In stock
Me Before You (Me Before You #1),One,£19.02,In stock
In the Woods (Dublin Murder Squad #1),Two,£38.38,In stock
In Cold Blood,Four,£49.98,In stock
How to Stop Worrying and Start Living,Five,£46.49,In stock
Give It Back,Two,£18.32,In stock
"Girl, Interrupted",Three,£42.14,In stock
Fun Home: A Family Tragicomic,Four,£56.59,In stock
"Fruits Basket, Vol. 6 (Fruits Basket #6)",Four,£20.96,In stock
Deception Point,Four,£40.32,In stock
"Death Note, Vol. 6: Give-and-Take (Death Note #6)",Three,£36.39,In stock
Catherine the Great: Portrait of a Woman,Four,£58.55,In stock
Better Homes and Gardens New Cook Book,Three,£39.61,In stock
An Unquiet Mind: A Memoir of Moods and Madness,Three,£21.30,In stock
A Year in Provence (Provence #1),Four,£56.88,In stock
World Without End (The Pillars of the Earth #2),Four,£32.97,In stock
"Will Grayson, Will Grayson (Will Grayson, Will Grayson)",Four,£47.31,In stock
Why Save the Bankers?: And Other Essays on Our Economic and Political Crisis,Two,£48.67,In stock
Where She Went (If I Stay #2),Four,£41.73,In stock
What If?: Serious Scientific Answers to Absurd Hypothetical Questions,Four,£53.68,In stock
Two Summers,One,£14.64,In stock
This Is Your Brain on Music: The Science of a Human Obsession,One,£38.40,In stock
The Secret Garden,Four,£15.08,In stock
The Raven King (The Raven Cycle #4),Two,£30.57,In stock
The Raven Boys (The Raven Cycle #1),Four,£57.74,In stock
The Power Greens Cookbook: 140 Delicious Superfood Recipes,Five,£11.05,In stock
The Metamorphosis,One,£28.58,In stock
The Mathews Men: Seven Brothers and the War Against Hitler's U-boats,Five,£42.91,In stock
The Little Paris Bookshop,Three,£24.73,In stock
The Hiding Place,Four,£55.91,In stock
The Grand Design,Three,£13.76,In stock
The Firm,Three,£45.56,In stock
The Fault in Our Stars,One,£47.22,In stock
The False Prince (The Ascendance Trilogy #1),Five,£56.00,In stock
The Expatriates,Two,£44.58,In stock
The Dream Thieves (The Raven Cycle #2),One,£34.50,In stock
The Darkest Corners,Five,£11.33,In stock
The Crossover,Four,£38.77,In stock
The 5th Wave (The 5th Wave #1),Two,£11.83,In stock
Tell the Wind and Fire,Three,£45.51,In stock
Tell Me Three Things,One,£41.81,In stock
Talking to Girls About Duran Duran: One Young Man's Quest for True Love and a Cooler Haircut,Four,£25.15,In stock
Siddhartha,Five,£34.22,In stock
Shiver (The Wolves of Mercy Falls #1),Five,£16.23,In stock
Remember Me?,Three,£11.48,In stock
Red Dragon (Hannibal Lecter #1),Three,£23.37,In stock
Peak: Secrets from the New Science of Expertise,Two,£16.28,In stock
My Mother Was Nuts,Four,£31.63,In stock
Mexican Today: New and Rediscovered Recipes for Contemporary Kitchens,Five,£24.91,In stock
Maybe Something Beautiful: How Art Transformed a Neighborhood,One,£22.54,In stock
Lola and the Boy Next Door (Anna and the French Kiss #2),Four,£23.63,In stock
Logan Kade (Fallen Crest High #5.5),Two,£13.12,In stock
Last One Home (New Beginnings #1),Three,£59.98,In stock
Killing Floor (Jack Reacher #1),Four,£31.49,In stock
Kill the Boy Band,Five,£15.52,In stock
Isla and the Happily Ever After (Anna and the French Kiss #3),Five,£48.13,In stock
If I Stay (If I Stay #1),Five,£38.13,In stock
I Know Why the Caged Bird Sings (Maya Angelou's Autobiography #1),Two,£36.55,In stock
Harry Potter and the Deathly Hallows (Harry Potter #7),One,£23.32,In stock
"Fruits Basket, Vol. 5 (Fruits Basket #5)",One,£16.33,In stock
Foundation (Foundation (Publication Order) #1),One,£32.42,In stock
Fool Me Once,One,£16.96,In stock
Find Her (Detective D.D. Warren #8),One,£22.37,In stock
Evicted: Poverty and Profit in the American City,One,£42.27,In stock
Drama,Two,£38.70,In stock
Dracula the Un-Dead,Five,£35.63,In stock
Digital Fortress,Five,£58.00,In stock
"Death Note, Vol. 5: Whiteout (Death Note #5)",One,£52.41,In stock
"Data, A Love Story: How I Gamed Online Dating to Meet My Match",Three,£32.35,In stock
Critique of Pure Reason,One,£20.75,In stock
Booked,Five,£17.49,In stock
"Blue Lily, Lily Blue (The Raven Cycle #3)",Five,£34.13,In stock
Approval Junkie: Adventures in Caring Too Much,Five,£58.81,In stock
An Abundance of Katherines,Five,£10.00,In stock
America's War for the Greater Middle East: A Military History,Two,£51.22,In stock
Alight (The Generations Trilogy #2),Four,£58.59,In stock
A Girl's Guide to Moving On (New Beginnings #2),One,£31.30,In stock
A Game of Thrones (A Song of Ice and Fire #1),Two,£46.42,In stock
A Feast for Crows (A Song of Ice and Fire #4),Four,£17.21,In stock
A Clash of Kings (A Song of Ice and Fire #2),Three,£10.79,In stock
Vogue Colors A to Z: A Fashion Coloring Book,Four,£52.35,In stock
The Shining (The Shining #1),Three,£27.88,In stock
The Pilgrim's Progress,Two,£50.26,In stock
The Perfect Play (Play by Play #1),Three,£59.99,In stock
The Passion of Dolssa,Five,£28.32,In stock
The Jazz of Physics: The Secret Link Between Music and the Structure of the Universe,Three,£38.71,In stock
The Hunger Games (The Hunger Games #1),Five,£29.85,In stock
The Hound of the Baskervilles (Sherlock Holmes #5),Two,£14.82,In stock
The Gunning of America: Business and the Making of American Gun Culture,Four,£16.81,In stock
The Geography of Bliss: One Grump's Search for the Happiest Places in the World,Two,£28.23,In stock
The Demonists (Demonist #1),Two,£52.11,In stock
"The Demon Prince of Momochi House, Vol. 4 (The Demon Prince of Momochi House #4)",Two,£27.88,In stock
The Bone Hunters (Lexy Vaughan & Steven Macaulay #2),Three,£59.71,In stock
The Beast (Black Dagger Brotherhood #14),Five,£46.08,In stock
Some Women,Five,£13.73,In stock
Shopaholic Ties the Knot (Shopaholic #3),Five,£48.39,In stock
Paper and Fire (The Great Library #2),Five,£49.45,In stock
Outlander (Outlander #1),Five,£19.67,In stock
"Orchestra of Exiles: The Story of Bronislaw Huberman, the Israel Philharmonic, and the One Thousand Jews He Saved from Nazi Horrors",Three,£12.36,In stock
No One Here Gets Out Alive,Five,£20.02,In stock
Night Shift (Night Shift #1-20),Four,£12.75,In stock
Needful Things,Four,£47.51,In stock
Mockingjay (The Hunger Games #3),Four,£20.44,In stock
Misery,Two,£34.79,In stock
Little Women (Little Women #1),Four,£28.07,In stock
It,Three,£25.01,In stock
Harry Potter and the Sorcerer's Stone (Harry Potter #1),Three,£13.90,In stock
Harry Potter and the Prisoner of Azkaban (Harry Potter #3),Four,£24.17,In stock
Harry Potter and the Order of the Phoenix (Harry Potter #5),Four,£31.63,In stock
Harry Potter and the Half-Blood Prince (Harry Potter #6),Five,£48.75,In stock
Harry Potter and the Chamber of Secrets (Harry Potter #2),One,£14.74,In stock
Gone with the Wind,Three,£32.49,In stock
God Is Not Great: How Religion Poisons Everything,One,£27.80,In stock
Girl With a Pearl Earring,One,£26.77,In stock
"Fruits Basket, Vol. 4 (Fruits Basket #4)",Four,£50.44,In stock
Far From True (Promise Falls Trilogy #2),Two,£34.93,In stock
Dark Lover (Black Dagger Brotherhood #1),One,£12.87,In stock
Confessions of a Shopaholic (Shopaholic #1),Two,£48.94,In stock
Changing the Game (Play by Play #2),Three,£13.38,In stock
Candide,Three,£58.63,In stock
Can You Keep a Secret?,One,£21.94,In stock
Atlas Shrugged,Five,£26.58,In stock
Animal Farm,Three,£57.22,In stock
A Walk to Remember,One,£56.43,In stock
A New Earth: Awakening to Your Life's Purpose,Five,£55.65,In stock
"A History of God: The 4,000-Year Quest of Judaism, Christianity, and Islam",One,£27.62,In stock
'Salem's Lot,Four,£49.56,In stock
Zero History (Blue Ant #3),One,£34.77,In stock
Wuthering Heights,Three,£17.73,In stock
World War Z: An Oral History of the Zombie War,One,£21.80,In stock
Wild: From Lost to Found on the Pacific Crest Trail,Three,£46.02,In stock
"Where'd You Go, Bernadette",One,£18.13,In stock
When You Are Engulfed in Flames,Five,£30.89,In stock
We the People: The Modern-Day Figures Who Have Reshaped and Affirmed the Founding Fathers' Vision of America,Three,£31.95,In stock
We Are All Completely Beside Ourselves,One,£24.04,In stock
Walk the Edge (Thunder Road #2),Three,£32.36,In stock
Voyager (Outlander #3),Five,£21.07,In stock
Very Good Lives: The Fringe Benefits of Failure and the Importance of Imagination,Three,£50.66,In stock
Vegan Vegetarian Omnivore: Dinner for Everyone at the Table,Two,£13.66,In stock
"Unstuffed: Decluttering Your Home, Mind, and Soul",One,£58.09,In stock
Under the Banner of Heaven: A Story of Violent Faith,One,£30.00,In stock
Two Boys Kissing,Two,£32.74,In stock
Twilight (Twilight #1),Two,£41.93,In stock
Twenties Girl,Two,£42.80,In stock
"Trespassing Across America: One Man's Epic, Never-Done-Before (and Sort of Illegal) Hike Across the Heartland",One,£53.51,In stock
Three-Martini Lunch,Three,£23.21,In stock
"Thinking, Fast and Slow",One,£21.14,In stock
The Wild Robot,Three,£56.07,In stock
"The Wicked + The Divine, Vol. 3: Commercial Suicide (The Wicked + The Divine)",Three,£14.41,In stock
The Undomestic Goddess,Four,£45.75,In stock
The Travelers,One,£15.77,In stock
The Tipping Point: How Little Things Can Make a Big Difference,Two,£10.02,In stock
The Thing About Jellyfish,One,£48.77,In stock
The Stand,Two,£57.86,In stock
The Smitten Kitchen Cookbook,One,£23.59,In stock
The Silkworm (Cormoran Strike #2),Five,£23.05,In stock
"The Sandman, Vol. 3: Dream Country (The Sandman (volumes) #3)",Five,£55.55,In stock
The Rose & the Dagger (The Wrath and the Dawn #2),Four,£58.64,In stock
The Road to Little Dribbling: Adventures of an American in Britain (Notes From a Small Island #2),One,£23.21,In stock
The Rise of Theodore Roosevelt (Theodore Roosevelt #1),Three,£42.57,In stock
The Restaurant at the End of the Universe (Hitchhiker's Guide to the Galaxy #2),One,£10.92,In stock
The Rest Is Noise: Listening to the Twentieth Century,One,£34.77,In stock
The Red Tent,Five,£35.66,In stock
The Purpose Driven Life: What on Earth Am I Here for?,Three,£37.19,In stock
The Purest Hook (Second Circle Tattoos #3),One,£12.25,In stock
The Picture of Dorian Gray,Two,£29.70,In stock
The Paris Wife,Three,£36.80,In stock
The Obsession,One,£45.43,In stock
The Nightingale,Four,£26.26,In stock
The New Guy (and Other Senior Year Distractions),Three,£44.92,In stock
The Nanny Diaries (Nanny #1),Five,£52.53,In stock
The Name of God is Mercy,Two,£37.25,In stock
The Maze Runner (The Maze Runner #1),One,£20.93,In stock
The Lover's Dictionary,Two,£58.09,In stock
The Lonely Ones,Five,£43.59,In stock
The Lean Startup: How Today's Entrepreneurs Use Continuous Innovation to Create Radically Successful Businesses,Three,£33.92,In stock
The Last Painting of Sara de Vos,Two,£55.55,In stock
"The Land of 10,000 Madonnas",Four,£29.64,In stock
The Infinities,One,£27.41,In stock
The Husband's Secret,Five,£52.51,In stock
The Hitchhiker's Guide to the Galaxy (Hitchhiker's Guide to the Galaxy #1),Three,£47.80,In stock
The Guns of August,Two,£14.54,In stock
The Guernsey Literary and Potato Peel Pie Society,One,£49.53,In stock
The Goldfinch,Three,£43.58,In stock
The Giver (The Giver Quartet #1),One,£12.30,In stock
The Girl with All the Gifts,Three,£49.47,In stock
The Girl Who Played with Fire (Millennium Trilogy #2),Two,£22.14,In stock
The Girl Who Kicked the Hornet's Nest (Millennium Trilogy #3),One,£57.48,In stock
The Exiled,Three,£43.45,In stock
"The End of Faith: Religion, Terror, and the Future of Reason",Four,£22.13,In stock
"The Elegant Universe: Superstrings, Hidden Dimensions, and the Quest for the Ultimate Theory",Four,£13.03,In stock
"The Disappearing Spoon: And Other True Tales of Madness, Love, and the History of the World from the Periodic Table of the Elements",Five,£57.35,In stock
The Devil Wears Prada (The Devil Wears Prada #1),One,£44.29,In stock
The Demon-Haunted World: Science as a Candle in the Dark,Four,£52.25,In stock
The Day the Crayons Came Home (Crayons),Five,£26.33,In stock
The Da Vinci Code (Robert Langdon #2),Two,£22.96,In stock
The Cuckoo's Calling (Cormoran Strike #1),One,£19.21,In stock
The Complete Stories and Poems (The Works of Edgar Allan Poe [Cameo Edition]),Four,£26.78,In stock
The Complete Poems,Five,£41.32,In stock
The Catcher in the Rye,One,£24.55,In stock
The Cat in the Hat (Beginner Books B-1),Two,£16.26,In stock
The Case for Christ (Cases for Christianity),One,£47.84,In stock
The Book Thief,Two,£53.49,In stock
The Book of Basketball: The NBA According to The Sports Guy,Five,£44.84,In stock
The Blind Side: Evolution of a Game,Five,£53.71,In stock
The Autobiography of Malcolm X,Two,£23.43,In stock
"The Art of Simple Food: Notes, Lessons, and Recipes from a Delicious Revolution",Three,£34.32,In stock
The Art of Fielding,One,£22.10,In stock
"Surely You're Joking, Mr. Feynman!: Adventures of a Curious Character",Two,£25.83,In stock
Stiff: The Curious Lives of Human Cadavers,Three,£36.74,In stock
Spilled Milk: Based on a True Story,One,£49.51,In stock
Something Borrowed (Darcy & Rachel #1),Five,£48.96,In stock
Something Blue (Darcy & Rachel #2),One,£54.62,In stock
Soldier (Talon #3),Two,£24.72,In stock
Shopaholic & Baby (Shopaholic #5),Two,£46.45,In stock
Seven Days in the Art World,Two,£52.33,In stock
Seven Brief Lessons on Physics,Four,£30.60,In stock
Scarlet (The Lunar Chronicles #2),Four,£14.57,In stock
Sarah's Key,One,£46.29,In stock
"Saga, Volume 3 (Saga (Collected Editions) #3)",Five,£21.57,In stock
Running with Scissors,Four,£12.91,In stock
Rogue Lawyer (Rogue Lawyer #1),Three,£50.11,In stock
"Rise of the Rocket Girls: The Women Who Propelled Us, from Missiles to the Moon to Mars",Four,£41.67,In stock
Rework,Two,£44.88,In stock
Reservations for Two,Three,£11.10,In stock
Red: The True Story of Red Riding Hood,Three,£28.54,In stock
Ready Player One,Four,£19.07,In stock
Quiet: The Power of Introverts in a World That Can't Stop Talking,One,£43.55,In stock
Prodigy: The Graphic Novel (Legend: The Graphic Novel #2),Three,£43.63,In stock
Persepolis: The Story of a Childhood (Persepolis #1-2),One,£39.13,In stock
Packing for Mars: The Curious Science of Life in the Void,Two,£56.68,In stock
Outliers: The Story of Success,One,£14.16,In stock
Original Fake,Three,£31.45,In stock
Orange Is the New Black,Two,£24.61,In stock
One for the Money (Stephanie Plum #1),Two,£32.87,In stock
Notes from a Small Island (Notes From a Small Island #1),One,£40.17,In stock
